{
  "artifacts": [
    {
      "artifact_id": "normalized.csv",
      "media_type": "text/csv",
      "path": "normalized.csv",
      "public_safe": true,
      "sha256": "3445e18cc213d4726e4d39d73226573822f6129c142b4cd5ee652134316ebf83"
    },
    {
      "artifact_id": "dataset_profile.json",
      "media_type": "application/json",
      "path": "dataset_profile.json",
      "public_safe": true,
      "sha256": "b88594bb554beaeb5b95d66a22094fed5b7bae29b857f20ee6306e1862d76e06"
    },
    {
      "artifact_id": "draft_contract_input.json",
      "media_type": "application/json",
      "path": "draft_contract_input.json",
      "public_safe": true,
      "sha256": "a7e3f2d8a7702e9948933747fc6b71f95e2d4f1e135a8ededdd1d54e09a0fbb0"
    },
    {
      "artifact_id": "draft_contract.json",
      "media_type": "application/json",
      "path": "draft_contract.json",
      "public_safe": true,
      "sha256": "7aa0e713aacea52e964a83b6a2d3eee50361bd61ee2e4d450bff3d53ca2f56a7"
    },
    {
      "artifact_id": "confirmed_contract.json",
      "media_type": "application/json",
      "path": "confirmed_contract.json",
      "public_safe": true,
      "sha256": "b8a251e9b41568e0f0e61c8052340e0586b105a869912d7a446d99d9d54e1e6c"
    },
    {
      "artifact_id": "registry_snapshot.json",
      "media_type": "application/json",
      "path": "registry_snapshot.json",
      "public_safe": true,
      "sha256": "1a26751609ef141d2eacb8345b2e91f854c4c6d3bef1e87c6a2afc0b885fbcf2"
    },
    {
      "artifact_id": "evidence_ledger.json",
      "media_type": "application/json",
      "path": "evidence_ledger.json",
      "public_safe": true,
      "sha256": "e22327c7045331bdd62e41f769480c6fec76a82c4c952d0a540ee6b118922943"
    },
    {
      "artifact_id": "error_envelope.json",
      "media_type": "application/json",
      "path": "error_envelope.json",
      "public_safe": true,
      "sha256": "647f862b2a6dd0087b7fb6cf931f1d4937cb7eb2ee231f52b6a2564bb3cbc019"
    }
  ],
  "code": {
    "build_week_delta_version": "task-013-stage1-golden-1.0.0",
    "commit_sha": "1e267b51715505e8598dd87714dd50535e01bf29",
    "dirty": false,
    "repository": "riec-guard"
  },
  "contract": {
    "confirmation_status": "confirmed",
    "contract_id": "AC-20276B7EEF90",
    "schema_version": "1.0.0",
    "sha256": "20276b7eef907f7f44c08adb5c1b8200a65296a240ff3216e38909a99eec11bc"
  },
  "environment": {
    "dependency_lock_sha256": "82116ddca67ef3da9b8bbf54942eb186cfcf6ace0b284dfdeabba9644effb76e",
    "platform": "platform-independent-golden",
    "python": "3.12.13"
  },
  "fallbacks": [],
  "finished_at": "2026-07-20T00:03:00Z",
  "gpt": {
    "api": "responses",
    "calls": [],
    "configured_model": "gpt-5.6-sol",
    "store": false
  },
  "inputs": [
    {
      "artifact_id": "stage1-public-synthetic.v1",
      "classification": "public_synthetic",
      "row_count": 80,
      "sha256": "3445e18cc213d4726e4d39d73226573822f6129c142b4cd5ee652134316ebf83"
    }
  ],
  "mode": "public_builtin",
  "privacy": {
    "direct_identifiers_sent_to_gpt": false,
    "raw_rows_sent_to_gpt": false,
    "release_scan_passed": false,
    "storage_root_class": "public_ephemeral"
  },
  "randomness": {
    "bootstrap_replicates": 200,
    "bootstrap_seed": 20260718,
    "global_seed": 20260718
  },
  "registries": {
    "action_engine_version": "1.0.0",
    "candidate_registry": {
      "id": "fill-structural-candidates.v1",
      "sha256": "ec0c22a712d338bc9209fafd7f26c65346f339a80e546fa8f3dda4de5a36635c",
      "version": "1.0.0"
    },
    "protocol_versions": {
      "D0_mean_diagnostic": "1.0.0",
      "G1_ordered_stability_screen": "1.0.0",
      "G2_evidence_sufficiency_gate": "1.0.0",
      "H1_empirical_strict_tail": "1.0.0",
      "H2_gaussian_residual_tail": "1.0.0",
      "H3_student_t_residual_tail": "1.0.0",
      "U1_whole_group_bootstrap": "1.0.0"
    }
  },
  "run_id": "RUN-A1B2C3D4E5F6",
  "schema_version": "1.0.0",
  "started_at": "2026-07-20T00:00:00Z",
  "status": "completed"
}
